"Department of Brain & Cognitive Sciences, McGovern Institute for Brain Research",1804
"Department of Neurobiology & Anatomy, McGovern Medical School at UTHealth",1804
MD Anderson Cancer Center,11
Tianjin Medical Laboratory,2852
"Department of Biological Sciences, Towson University",5435
UCL Institute of Ophthalmology,88
"Centre for Clinical Pharmacology, Division of Medicine, University College of London",88
Gatsby Computational Neuroscience Unit,88
"Molecular Nociception Group, Wolfson Institute for Biomedical Research",88
Molecular Medicine Partnership Unit (MMPU),3257
"Department of Biological Sciences, University of Alabama",3377
Centre for Research in Agricultural Genomics (CRAG) CSIC-IRTA-UAB-UB,672
"Group of Psychiatric Neuroscience, Department of Basic Medical Science, Neuroscience and Sense Organs, Aldo Moro University",1419
"Institute of Biochemistry and Molecular Medicine, University of Bern",744
Centre for Molecular Medicine and Therapeutics,1061
The University of British Columbia Centre for Heart Lung Innovation,1061
Innovative Genomics Institute,19
Novartis-Berkeley Center for Proteomics and Chemistry Technologies,19
Department of Microbiology and Molecular Genetics One Shields Avenue UC Davis Davis,600
Center for Complex Biological Systems,2105
The Eli and Edythe Broad Center of Regeneration Medicine and Stem Cell Research,974
"Instituto de Biomedicina y Biotecnología de Cantabria (IBBTEC), Universidad de Cantabria-CSIC, and Department of Molecular Biology, Universidad de Cantabria",76
"Ben May Department for Cancer Research, University of Chicago",50
UChicago Research Bangladesh,50
"Ben May Department for Cancer Research, The University of Chicago",50
"Ben May Department for Cancer Research, the University of Chicago",50
"Ben May Department of Cancer Research, University of Chicago",50
"Department of Neuroscience, Imaging, and Clinical Sciences, University G. d'Annunzio of Chieti-Pescara",4295
"Department of Genetics and Genome Sciences, Institute for Systems Genomics",454
"Marine Biological Section, Department of Biology, University of Copenhagen",782
"Department of Biological Sciences, University of Denver",3753
"Institute of Immunology, Medical Faculty, University of Duisburg-Essen",706
Centre for Cognitive Ageing and Cognitive Epidemiology,56
The Clinical Hospital of Chengdu Brain Science Institute,4802
"Institute of Physical Chemistry, Göttingen University",272
", Göttingen",272
"Institut für Röntgenphysik, Göttingen",272
"International Max Planck Research School for Molecular Biology, Göttingen",272
"International Max Planck Research School for Neurosciences, Göttingen",272
"Institute of Microbiology and Molecular Biology, University of Giessen",113
"Department of Human Nutrition, Institute of Public Health, College of Medicine and Health Sciences, University of Gondar",2766
"Department of Marine Sciences, University of Gothenburg",1546
"Molecular Genetics Group, Groningen Biomolecular Sciences and Biotechnology Institute, Centre for Synthetic Biology, University of Groningen",779
"Marine Evolution and Conservation, Groningen Institute of Evolutionary Life Sciences, University of Groningen",779
"Department of Biological and Marine Sciences, University of Hull",4458
"Department of Virology, College of Medicine, University of Ibadan",2924
"Department of Plant Biology, University of Illinois",1079
"Department of Psychiatry, University of Iowa Carver College of Medicine",95
"Department of Anatomy and Cell Biology, University of Kansas Medical Center",3653
"Department of Biochemistry and Molecular Biology, University of Kansas Medical Center",3653
"Univ. Lille, CNRS, INSERM, CHU Lille, Institut Pasteur de Lille, U1019 - UMR 8204 - CIIL - Center for Infection and Immunity of Lille",2697
"University of Lille, CNRS, INSERM, CHU Lille, Pasteur Institute of Lille, U1019-UMR 8204-CIIL-Center for Infection and Immunity of Lille",2697
Department of Crop and Forest Sciences-AGROTECNIO Center,3183
Luxembourg Centre for Systems Biomedicine,43
RNA Therapeutics Institute,1209
Michigan Center for Integrative Research in Critical Care,8
ICVS/3B's - PT Government Associate Laboratory,2019
Institut de Biologie Computationnelle,2019
"BioTechnology Institute, University of Minnesota",124
"Department of Plant Biology, University of Minnesota",124
"Biotechnology Institute, University of Minnesota",124
Biotechnology Institute,124
"BioTechnology Institute, University of Minnesota ‚Äì Twin Cities",124
"Biotechnology Institute and Department of Ecology, Evolution and Behavior, University of Minnesota",124
"BioTechnology Institute, Department of Microbiology, University of Minnesota",124
"BioTechnology Institute, Department of Biochemistry",124
"BioTechnology Institute and Department of Plant and Microbial Biology, University of Minnesota",124
"BioTechnology Institute, University of Minnesota-Twin Cities",124
"mRNA Regulation and Development, Institute of Human Genetics, UMR9002 CNRS-Univ Montpellier",296
"School of Biological Sciences, University of Nebraska",382
"Laboratory of Evolutionary Genetics, Institute of Biology, University of Neuchâtel",4970
"Institute of Biology, University of Neuchâtel",4970
"Modernizing Medical Microbiology Consortium, Nuffield Department of Clinical Medicine",123
"Centre for Tropical Medicine and Global Health, Nuffield Department of Medicine",123
"Centre for Tropical Medicine, Nuffield Department of Medicine",123
"Nuffield Department of Medicine, Nuffield Department of Medicine Research Building",123
"Cancer Epidemiology Unit, Nuffield Department of Population Health",123
Institute for Integrative Biology of the Cell (I2BC),880
"Department of Pathobiology, University of Pennsylvania School of Veterinary Medicine",20
Center for Causal Discovery,178
"Instituto de Investigação e Inovação em Saúde and Instituto de Biologia Molecular e Celular, Universidade do Porto. Porto",190
"Institute of Biochemistry and Biology, University of Potsdam",1317
"University of South Bohemia, Faculty of Science",4377
"Institut de Génétique et de Biologie Moléculaire et Cellulaire (IGBMC), CNRS (UMR 7104), Inserm U964, Université de Strasbourg",2723
"Centre National de la Recherche Scientifique, Université de Strasbourg, Institut des Neurosciences Cellulaires et Intégratives",2723
"CNRS UPR3212, Institut des Neurosciences Cellulaires et Intégratives",2723
"Department of Biological Sciences, University of Toronto Scarborough",9
"Institut de Pharmacologie et de Biologie Structurale (IPBS), Université de Toulouse, CNRS, UPS",325
"Institute of Biophysics, CNR Unit at Trento",611
"IRGB, CNR",611
"Istituto per lo Studio dei Materiali Nanostrutturati, CNR",611
"Istituto di Ricerca Genetica e Biomedica (IRGB), CNR",611
Vienna Graduate School of Population Genetics,1722
"Centre for Mechanochemical Cell Biology, Warwick Medical School",1602
University of Washington Department of Genome Sciences,152
Washington National Primate Research Center,152
"Institute of Pharmacology and Toxicology, University of Zurich",669
Neuroscience Center Zurich,669
Veterans Affairs Connecticut Healthcare System,2993
"Department of Biology, Valparaiso University",5018
"Department of Biomedical Informatics, Vanderbilt University Medical Center",3670
"Institute of Biotechnology, Vilnius University",3291
Virginia Tech Carilion Research Institute,259
"Department of Biological Psychology, Vrije Universiteit",399
VIB-VUB Center for Structural Biology,399
"Department of Experimental and Applied Psychology, Vrije Universiteit",399
"Department of Physiology and Pharmacology, Wake Forest School of Medicine",2184
"Department of Cancer Biology, Wake Forest School of Medicine",2184
"Department of Biochemistry, Wake Forest School of Medicine",2184
"Department of Neurobiology and Anatomy, Wake Forest School of Medicine",2184
Hope Center for Neurological Disorders,2096
The Bin Talal Bin Abdulaziz Alsaud Institute for Computational Biomedicine 1305 York Ave.,662
Burke Neurological Institute,662
"Department of Biochemistry, Schulich School of Medicine and Dentistry, Western University",558
Whitehead Institute,1797
Translational Cardiovascular Therapeutics William Harvey Research Institute,2771
International Healthcare Innovation Institute (Jiangmen),5927
"Department of Biological Sciences, Xi'an Jiaotong-Liverpool University",6241
"Department of Biology, Centre for Vision Research, York University",2423